{
  "study_id": "CXR1401",
  "image_id": "CXR1401_IM-0256-1002",
  "view": "Frontal",
  "findings": [
    {
      "finding": "Lung Opacity",
      "statement": "Possible lung opacity cannot be excluded; correlation is advised.",
      "status": "possible",
      "location": "unspecified",
      "severity": "unspecified"
    },
    {
      "finding": "Infiltration",
      "statement": "Possible infiltration cannot be excluded; correlation is advised.",
      "status": "possible",
      "location": "unspecified",
      "severity": "unspecified"
    },
    {
      "finding": "Mass",
      "statement": "Possible mass cannot be excluded; correlation is advised.",
      "status": "possible",
      "location": "unspecified",
      "severity": "unspecified"
    },
    {
      "finding": "Enlarged Cardiomediastinum",
      "statement": "Possible enlarged cardiomediastinum cannot be excluded; correlation is advised.",
      "status": "possible",
      "location": "unspecified",
      "severity": "unspecified"
    },
    {
      "finding": "Pleural_Thickening",
      "statement": "Possible pleural_thickening cannot be excluded; correlation is advised.",
      "status": "possible",
      "location": "unspecified",
      "severity": "unspecified"
    },
    {
      "finding": "Fibrosis",
      "statement": "Possible fibrosis cannot be excluded; correlation is advised.",
      "status": "possible",
      "location": "unspecified",
      "severity": "unspecified"
    },
    {
      "finding": "Nodule",
      "statement": "Possible nodule cannot be excluded; correlation is advised.",
      "status": "possible",
      "location": "unspecified",
      "severity": "unspecified"
    },
    {
      "finding": "Emphysema",
      "statement": "Possible emphysema cannot be excluded; correlation is advised.",
      "status": "possible",
      "location": "unspecified",
      "severity": "unspecified"
    },
    {
      "finding": "Fracture",
      "statement": "Possible fracture cannot be excluded; correlation is advised.",
      "status": "possible",
      "location": "unspecified",
      "severity": "unspecified"
    },
    {
      "finding": "Consolidation",
      "statement": "Possible consolidation cannot be excluded; correlation is advised.",
      "status": "possible",
      "location": "unspecified",
      "severity": "unspecified"
    },
    {
      "finding": "Pneumothorax",
      "statement": "Possible pneumothorax cannot be excluded; correlation is advised.",
      "status": "possible",
      "location": "unspecified",
      "severity": "unspecified"
    },
    {
      "finding": "Effusion",
      "statement": "Possible effusion cannot be excluded; correlation is advised.",
      "status": "possible",
      "location": "unspecified",
      "severity": "unspecified"
    },
    {
      "finding": "Cardiomegaly",
      "statement": "Possible cardiomegaly cannot be excluded; correlation is advised.",
      "status": "possible",
      "location": "unspecified",
      "severity": "unspecified"
    }
  ],
  "impression": [
    "1. Possible lung opacity, Possible infiltration, Possible mass, Possible enlarged cardiomediastinum, Possible pleural_thickening, Possible fibrosis, Possible nodule, Possible emphysema, Possible fracture, Possible consolidation, Possible pneumothorax, Possible effusion, Possible cardiomegaly; recommend clinical correlation."
  ],
  "metadata": {
    "provider": "mock",
    "model": "mock-radiology-llm",
    "generated_at": "2026-09-24T02:22:51Z"
  }
}