{
  "study_id": "CXR1053",
  "image_id": "CXR1053_IM-0040-1001",
  "view": "Frontal",
  "findings": [
    {
      "finding": "Fibrosis",
      "statement": "Possible fibrosis cannot be excluded; correlation is advised.",
      "status": "possible",
      "location": "unspecified",
      "severity": "unspecified"
    },
    {
      "finding": "Cardiomegaly",
      "statement": "Possible cardiomegaly cannot be excluded; correlation is advised.",
      "status": "possible",
      "location": "unspecified",
      "severity": "unspecified"
    },
    {
      "finding": "Pleural_Thickening",
      "statement": "Possible pleural_thickening cannot be excluded; correlation is advised.",
      "status": "possible",
      "location": "unspecified",
      "severity": "unspecified"
    },
    {
      "finding": "Nodule",
      "statement": "Possible nodule cannot be excluded; correlation is advised.",
      "status": "possible",
      "location": "unspecified",
      "severity": "unspecified"
    },
    {
      "finding": "Emphysema",
      "statement": "Possible emphysema cannot be excluded; correlation is advised.",
      "status": "possible",
      "location": "unspecified",
      "severity": "unspecified"
    },
    {
      "finding": "Infiltration",
      "statement": "Possible infiltration cannot be excluded; correlation is advised.",
      "status": "possible",
      "location": "unspecified",
      "severity": "unspecified"
    },
    {
      "finding": "Atelectasis",
      "statement": "Possible atelectasis cannot be excluded; correlation is advised.",
      "status": "possible",
      "location": "unspecified",
      "severity": "unspecified"
    },
    {
      "finding": "Pneumothorax",
      "statement": "Possible pneumothorax cannot be excluded; correlation is advised.",
      "status": "possible",
      "location": "unspecified",
      "severity": "unspecified"
    },
    {
      "finding": "Effusion",
      "statement": "Possible effusion cannot be excluded; correlation is advised.",
      "status": "possible",
      "location": "unspecified",
      "severity": "unspecified"
    },
    {
      "finding": "Consolidation",
      "statement": "Possible consolidation cannot be excluded; correlation is advised.",
      "status": "possible",
      "location": "unspecified",
      "severity": "unspecified"
    }
  ],
  "impression": [
    "1. Possible fibrosis, Possible cardiomegaly, Possible pleural_thickening, Possible nodule, Possible emphysema, Possible infiltration, Possible atelectasis, Possible pneumothorax, Possible effusion, Possible consolidation; recommend clinical correlation."
  ],
  "metadata": {
    "provider": "mock",
    "model": "mock-radiology-llm",
    "generated_at": "2026-09-24T01:15:19Z"
  }
}